{
  "app": "nebula",
  "dimension": "ip",
  "filter": {},
  "function": {
    "config": {},
    "method": "top",
    "object": "value",
    "object_subtype": "long",
    "object_type": "map",
    "param": "c_ip",
    "source": "ip__visit_dynamic_distinct_count_uid__1h__slot"
  },
  "groupbykeys": [],
  "hint": {},
  "module": "slot",
  "name": "ip__visit_dynamic_distinct_count_uid_top100__1h__slot",
  "period": {
    "type": "hourly",
    "value": "1"
  },
  "remark": "每小时关联uid量前100的ip",
  "source": [
    {
      "app": "nebula",
      "name": "ip__visit_dynamic_distinct_count_uid__1h__slot"
    }
  ],
  "status": "enable",
  "type": "top",
  "value_category": "",
  "value_subtype": "long",
  "value_type": "mmap",
  "visible_name": "每小时关联uid前100的ip"
}
