{
  "app": "nebula",
  "dimension": "did",
  "filter": {},
  "function": {
    "config": {},
    "method": "count",
    "object": "",
    "object_subtype": "",
    "object_type": "",
    "param": "",
    "source": "ACCOUNT_REGISTRATION"
  },
  "groupbykeys": [
    "did"
  ],
  "hint": {},
  "module": "realtime",
  "name": "did__account_regist_count__5m__rt",
  "period": {
    "type": "last_n_seconds",
    "value": "300"
  },
  "remark": "单个DID5分钟内注册请求总和",
  "source": [
    {
      "app": "nebula",
      "name": "ACCOUNT_REGISTRATION"
    }
  ],
  "status": "enable",
  "type": "aggregate",
  "value_category": "",
  "value_subtype": "",
  "value_type": "long",
  "visible_name": "DID注册请求总数[5m]"
}
