{
  "app": "nebula",
  "dimension": "ip",
  "filter": {},
  "function": {
    "config": {},
    "method": "+",
    "object": "value",
    "object_subtype": "",
    "object_type": "long",
    "param": "",
    "source": "ip__visit_static_count__5m__rt"
  },
  "groupbykeys": [
    "c_ip"
  ],
  "hint": {},
  "module": "realtime",
  "name": "ip__visit_count__5m__rt",
  "period": {
    "type": "last_n_seconds",
    "value": "300"
  },
  "remark": "单个IP5分钟访问量总和",
  "source": [
    {
      "app": "nebula",
      "name": "ip__visit_static_count__5m__rt"
    },
    {
      "app": "nebula",
      "name": "ip__visit_dynamic_count__5m__rt"
    }
  ],
  "status": "enable",
  "type": "dual",
  "value_category": "",
  "value_subtype": "",
  "value_type": "long",
  "visible_name": "IP请求量[5m]"
}
