{
  "app": "nebula",
  "dimension": "did",
  "filter": {
    "object": "uid",
    "object_subtype": "",
    "object_type": "string",
    "operation": "!=",
    "param": "",
    "source": "ACCOUNT_REGISTRATION",
    "type": "simple",
    "value": ""
  },
  "function": {
    "config": {},
    "method": "distinct_count",
    "object": "uid",
    "object_subtype": "",
    "object_type": "string",
    "param": "",
    "source": "ACCOUNT_REGISTRATION"
  },
  "groupbykeys": [
    "did"
  ],
  "hint": {},
  "module": "realtime",
  "name": "did__account_regist_distinct_count_uid__5m__rt",
  "period": {
    "type": "last_n_seconds",
    "value": "300"
  },
  "remark": "单个DID5分钟内注册的UID数量",
  "source": [
    {
      "app": "nebula",
      "name": "ACCOUNT_REGISTRATION"
    }
  ],
  "status": "enable",
  "type": "aggregate",
  "value_category": "",
  "value_subtype": "",
  "value_type": "long",
  "visible_name": "DID注册不同UID数[5m]"
}
