{
  "app": "nebula",
  "dimension": "did",
  "filter": {
    "object": "page",
    "object_subtype": "",
    "object_type": "string",
    "operation": "!=",
    "param": "",
    "source": "HTTP_DYNAMIC",
    "type": "simple",
    "value": ""
  },
  "function": {
    "config": {},
    "method": "distinct_count",
    "object": "page",
    "object_subtype": "",
    "object_type": "string",
    "param": "",
    "source": "HTTP_DYNAMIC"
  },
  "groupbykeys": [
    "did"
  ],
  "hint": {},
  "module": "realtime",
  "name": "did__visit_dynamic_distinct_count_page__5m__rt",
  "period": {
    "type": "last_n_seconds",
    "value": "300"
  },
  "remark": "单个DID5分钟动态资源访问page数量",
  "source": [
    {
      "app": "nebula",
      "name": "HTTP_DYNAMIC"
    }
  ],
  "status": "enable",
  "type": "aggregate",
  "value_category": "",
  "value_subtype": "",
  "value_type": "long",
  "visible_name": "DID动态请求不同页面数[5m]"
}
