{
  "app": "nebula",
  "dimension": "",
  "filter": {},
  "function": {},
  "groupbykeys": [],
  "hint": {},
  "module": "base",
  "name": "ACCOUNT_CERTIFICATION",
  "period": {},
  "remark": "账号-实名验证",
  "source": [
    {
      "app": "nebula",
      "name": "ACCOUNT_CERTIFICATION"
    }
  ],
  "status": "enable",
  "type": "event",
  "value_category": "",
  "value_subtype": "",
  "value_type": "",
  "visible_name": "账号-实名验证"
}
