{
  "app": "nebula",
  "dimension": "uid",
  "filter": {},
  "function": {
    "config": {},
    "method": "count",
    "object": "",
    "object_subtype": "",
    "object_type": "",
    "param": "",
    "source": "HTTP_DYNAMIC"
  },
  "groupbykeys": [
    "uid"
  ],
  "hint": {},
  "module": "realtime",
  "name": "uid__visit_dynamic_count__5m__rt",
  "period": {
    "type": "last_n_seconds",
    "value": "300"
  },
  "remark": "单个UID5分钟动态资源访问量总和",
  "source": [
    {
      "app": "nebula",
      "name": "HTTP_DYNAMIC"
    }
  ],
  "status": "enable",
  "type": "aggregate",
  "value_category": "",
  "value_subtype": "",
  "value_type": "long",
  "visible_name": "UID动态资源请求量[5m]"
}
