{
  "app": "nebula",
  "dimension": "page",
  "filter": {},
  "function": {
    "config": {},
    "method": "top",
    "object": "value",
    "object_subtype": "long",
    "object_type": "mmap",
    "param": "c_ip",
    "source": "page_ip__visit_dynamic_group_count__1h__slot"
  },
  "groupbykeys": [
    "page"
  ],
  "hint": {},
  "module": "slot",
  "name": "page_ip__visit_dynamic_count_top100__1h__slot",
  "period": {
    "type": "hourly",
    "value": "1"
  },
  "remark": "单个页面上访问量前100的ip",
  "source": [
    {
      "app": "nebula",
      "name": "page_ip__visit_dynamic_group_count__1h__slot"
    }
  ],
  "status": "enable",
  "type": "top",
  "value_category": "",
  "value_subtype": "long",
  "value_type": "mmap",
  "visible_name": "单个页面上访问量前100的ip"
}
