{
  "app": "nebula",
  "dimension": "page",
  "filter": {},
  "function": {
    "config": {},
    "method": "count",
    "object": "",
    "object_subtype": "",
    "object_type": "",
    "param": "",
    "source": "HTTP_INCIDENT"
  },
  "groupbykeys": [
    "page"
  ],
  "hint": {},
  "module": "slot",
  "name": "page__visit_incident_count__1h__slot",
  "period": {
    "type": "hourly",
    "value": "1"
  },
  "remark": "单个页面每小时风险访问量",
  "source": [
    {
      "app": "nebula",
      "name": "HTTP_INCIDENT"
    }
  ],
  "status": "enable",
  "type": "aggregate",
  "value_category": "",
  "value_subtype": "long",
  "value_type": "map",
  "visible_name": "单个页面每小时风险访问量"
}
