{
  "app": "nebula",
  "dimension": "ip",
  "filter": {},
  "function": {
    "config": {},
    "method": "avg",
    "object": "c_bytes",
    "object_subtype": "",
    "object_type": "long",
    "param": "",
    "source": "HTTP_DYNAMIC"
  },
  "groupbykeys": [
    "c_ip"
  ],
  "hint": {},
  "module": "realtime",
  "name": "ip__visit_dynamic_avg_cbytes__5m__rt",
  "period": {
    "type": "last_n_seconds",
    "value": "300"
  },
  "remark": "单个IP5分钟内请求大小平均值",
  "source": [
    {
      "app": "nebula",
      "name": "HTTP_DYNAMIC"
    }
  ],
  "status": "enable",
  "type": "aggregate",
  "value_category": "",
  "value_subtype": "",
  "value_type": "double",
  "visible_name": "单个IP5分钟内请求大小平均值"
}
