{
  "app": "nebula",
  "dimension": "did",
  "filter": {},
  "function": {
    "config": {},
    "method": "group_count",
    "object": "",
    "object_subtype": "",
    "object_type": "",
    "param": "geo_city",
    "source": "HTTP_DYNAMIC"
  },
  "groupbykeys": [
    "did"
  ],
  "hint": {},
  "module": "slot",
  "name": "did_geo_city__visit_dynamic_group_count__1h__slot",
  "period": {
    "type": "hourly",
    "value": "1"
  },
  "remark": "单个did每小时每个城市的动态资源访问数量",
  "source": [
    {
      "app": "nebula",
      "name": "HTTP_DYNAMIC"
    }
  ],
  "status": "enable",
  "type": "aggregate",
  "value_category": "",
  "value_subtype": "long",
  "value_type": "mmap",
  "visible_name": "单个did每小时每个城市的动态资源访问数量"
}
