{
  "app": "nebula",
  "dimension": "page",
  "filter": {},
  "function": {
    "config": {},
    "method": "group_count",
    "object": "",
    "object_subtype": "",
    "object_type": "",
    "param": "uid",
    "source": "HTTP_DYNAMIC"
  },
  "groupbykeys": [
    "page"
  ],
  "hint": {},
  "module": "slot",
  "name": "page_uid__visit_dynamic_group_count__1h__slot",
  "period": {
    "type": "hourly",
    "value": "1"
  },
  "remark": "单个页面上每个用户当前小时访问数",
  "source": [
    {
      "app": "nebula",
      "name": "HTTP_DYNAMIC"
    }
  ],
  "status": "enable",
  "type": "aggregate",
  "value_category": "",
  "value_subtype": "long",
  "value_type": "mmap",
  "visible_name": "单个页面上每个用户当前小时访问数"
}
