{
  "app": "nebula",
  "dimension": "uid",
  "filter": {
    "condition": [
      {
        "object": "result",
        "object_subtype": "",
        "object_type": "string",
        "operation": "==",
        "param": "",
        "source": "ACCOUNT_TOKEN_CHANGE",
        "type": "simple",
        "value": "T"
      },
      {
        "object": "token_type",
        "object_subtype": "",
        "object_type": "string",
        "operation": "==",
        "param": "",
        "source": "ACCOUNT_TOKEN_CHANGE",
        "type": "simple",
        "value": "mobile"
      }
    ],
    "type": "and"
  },
  "function": {
    "config": {},
    "method": "last",
    "object": "new_token",
    "object_subtype": "",
    "object_type": "string",
    "param": "",
    "source": "ACCOUNT_TOKEN_CHANGE"
  },
  "groupbykeys": [
    "uid"
  ],
  "hint": {},
  "module": "profile",
  "name": "uid__account_token_change_mobile__profile",
  "period": {
    "type": "ever",
    "value": ""
  },
  "remark": "帐号修改的手机号",
  "source": [
    {
      "app": "nebula",
      "name": "ACCOUNT_TOKEN_CHANGE"
    }
  ],
  "status": "enable",
  "type": "aggregate",
  "value_category": "",
  "value_subtype": "",
  "value_type": "string",
  "visible_name": "帐号修改的手机号"
}
