{
  "app": "nebula",
  "dimension": "global",
  "filter": {},
  "function": {
    "config": {},
    "method": "count",
    "object": "",
    "object_subtype": "",
    "object_type": "",
    "param": "",
    "source": "HTTP_DYNAMIC"
  },
  "groupbykeys": [],
  "hint": {},
  "module": "slot",
  "name": "global__visit_dynamic_count__1h__slot",
  "period": {
    "type": "hourly",
    "value": "1"
  },
  "remark": "本小时动态资源访问总量",
  "source": [
    {
      "app": "nebula",
      "name": "HTTP_DYNAMIC"
    }
  ],
  "status": "enable",
  "type": "aggregate",
  "value_category": "",
  "value_subtype": "long",
  "value_type": "map",
  "visible_name": "本小时动态资源访问总量"
}
